{
  "$schema": "https://json-schema.org/draft/2020-12/schema",
  "$id": "https://bugate.io/v2/schemas/scope_contract.schema.json",
  "title": "BUGate ScopeContract",
  "type": "object",
  "additionalProperties": false,
  "properties": {
    "apiVersion": {
      "const": "bugate.io/v2"
    },
    "kind": {
      "const": "ScopeContract"
    },
    "id": {
      "type": "string",
      "pattern": "^[A-Za-z0-9][A-Za-z0-9_.:-]{0,127}$"
    },
    "revision": {
      "type": "integer",
      "minimum": 1
    },
    "schema_version": {
      "const": "2.1.0-dev.1"
    },
    "task_id": {
      "type": "string",
      "pattern": "^[A-Za-z0-9][A-Za-z0-9_.:-]{0,127}$"
    },
    "workspace_id": {
      "type": "string",
      "pattern": "^sha256:[0-9a-f]{64}$"
    },
    "request_refs": {
      "type": "array",
      "items": {
        "type": "object",
        "additionalProperties": false,
        "properties": {
          "request_id": {
            "type": "string",
            "pattern": "^[A-Za-z0-9][A-Za-z0-9_.:-]{0,127}$"
          },
          "quote": {
            "type": "string",
            "minLength": 1,
            "pattern": "\\S"
          }
        },
        "required": [
          "request_id",
          "quote"
        ]
      },
      "minItems": 1,
      "uniqueItems": true
    },
    "request_digests": {
      "type": "object",
      "additionalProperties": {
        "type": "string",
        "pattern": "^sha256:[0-9a-f]{64}$"
      },
      "minProperties": 1
    },
    "source_refs": {
      "type": "array",
      "items": {
        "type": "string",
        "pattern": "^[A-Za-z0-9][A-Za-z0-9_.:-]{0,127}$"
      },
      "minItems": 1,
      "uniqueItems": true
    },
    "objectives": {
      "type": "array",
      "items": {
        "type": "object",
        "additionalProperties": false,
        "properties": {
          "id": {
            "type": "string",
            "pattern": "^[A-Za-z0-9][A-Za-z0-9_.:-]{0,127}$"
          },
          "statement": {
            "type": "string",
            "minLength": 1,
            "pattern": "\\S"
          },
          "request_refs": {
            "type": "array",
            "items": {
              "type": "object",
              "additionalProperties": false,
              "properties": {
                "request_id": {
                  "type": "string",
                  "pattern": "^[A-Za-z0-9][A-Za-z0-9_.:-]{0,127}$"
                },
                "quote": {
                  "type": "string",
                  "minLength": 1,
                  "pattern": "\\S"
                }
              },
              "required": [
                "request_id",
                "quote"
              ]
            },
            "minItems": 1,
            "uniqueItems": true
          }
        },
        "required": [
          "id",
          "statement",
          "request_refs"
        ]
      },
      "minItems": 1,
      "uniqueItems": true
    },
    "subject": {
      "type": "object",
      "additionalProperties": false,
      "properties": {
        "object": {
          "type": "string",
          "minLength": 1,
          "pattern": "\\S"
        },
        "environment_ids": {
          "type": "array",
          "items": {
            "type": "string",
            "pattern": "^[A-Za-z0-9][A-Za-z0-9_.:-]{0,127}$"
          },
          "minItems": 1,
          "uniqueItems": true
        },
        "context_boundaries": {
          "type": "array",
          "items": {
            "type": "string",
            "minLength": 1,
            "pattern": "\\S"
          },
          "minItems": 1,
          "uniqueItems": true
        }
      },
      "required": [
        "object",
        "environment_ids",
        "context_boundaries"
      ]
    },
    "flows": {
      "type": "array",
      "items": {
        "type": "object",
        "additionalProperties": false,
        "properties": {
          "id": {
            "type": "string",
            "pattern": "^[A-Za-z0-9][A-Za-z0-9_.:-]{0,127}$"
          },
          "objective_ids": {
            "type": "array",
            "items": {
              "type": "string",
              "pattern": "^[A-Za-z0-9][A-Za-z0-9_.:-]{0,127}$"
            },
            "minItems": 1,
            "uniqueItems": true
          },
          "entry": {
            "type": "string",
            "minLength": 1,
            "pattern": "\\S"
          },
          "key_nodes": {
            "type": "array",
            "items": {
              "type": "string",
              "minLength": 1,
              "pattern": "\\S"
            },
            "minItems": 1,
            "uniqueItems": true
          },
          "terminal": {
            "type": "string",
            "minLength": 1,
            "pattern": "\\S"
          },
          "branch_of": {
            "anyOf": [
              {
                "type": "string",
                "pattern": "^[A-Za-z0-9][A-Za-z0-9_.:-]{0,127}$"
              },
              {
                "type": "null"
              }
            ]
          }
        },
        "required": [
          "id",
          "objective_ids",
          "entry",
          "key_nodes",
          "terminal",
          "branch_of"
        ]
      },
      "minItems": 1,
      "uniqueItems": true
    },
    "requirements": {
      "type": "array",
      "items": {
        "type": "object",
        "additionalProperties": false,
        "properties": {
          "id": {
            "type": "string",
            "pattern": "^[A-Za-z0-9][A-Za-z0-9_.:-]{0,127}$"
          },
          "objective_ids": {
            "type": "array",
            "items": {
              "type": "string",
              "pattern": "^[A-Za-z0-9][A-Za-z0-9_.:-]{0,127}$"
            },
            "minItems": 1,
            "uniqueItems": true
          },
          "oracle_ids": {
            "type": "array",
            "items": {
              "type": "string",
              "pattern": "^[A-Za-z0-9][A-Za-z0-9_.:-]{0,127}$"
            },
            "minItems": 1,
            "uniqueItems": true
          },
          "basis": {
            "type": "object",
            "additionalProperties": false,
            "properties": {
              "kind": {
                "enum": [
                  "user_explicit",
                  "necessary_condition"
                ]
              },
              "request_refs": {
                "type": "array",
                "items": {
                  "type": "object",
                  "additionalProperties": false,
                  "properties": {
                    "request_id": {
                      "type": "string",
                      "pattern": "^[A-Za-z0-9][A-Za-z0-9_.:-]{0,127}$"
                    },
                    "quote": {
                      "type": "string",
                      "minLength": 1,
                      "pattern": "\\S"
                    }
                  },
                  "required": [
                    "request_id",
                    "quote"
                  ]
                },
                "minItems": 1,
                "uniqueItems": true
              },
              "explanation": {
                "type": "string",
                "minLength": 1,
                "pattern": "\\S"
              }
            },
            "required": [
              "kind",
              "request_refs",
              "explanation"
            ]
          }
        },
        "required": [
          "id",
          "objective_ids",
          "oracle_ids",
          "basis"
        ]
      },
      "minItems": 1,
      "uniqueItems": true
    },
    "risk_ids": {
      "type": "array",
      "items": {
        "type": "string",
        "pattern": "^[A-Za-z0-9][A-Za-z0-9_.:-]{0,127}$"
      },
      "minItems": 0,
      "uniqueItems": true
    },
    "scenarios": {
      "type": "array",
      "items": {
        "type": "object",
        "additionalProperties": false,
        "properties": {
          "id": {
            "type": "string",
            "pattern": "^[A-Za-z0-9][A-Za-z0-9_.:-]{0,127}$"
          },
          "requirement_ids": {
            "type": "array",
            "items": {
              "type": "string",
              "pattern": "^[A-Za-z0-9][A-Za-z0-9_.:-]{0,127}$"
            },
            "minItems": 1,
            "uniqueItems": true
          },
          "flow_id": {
            "type": "string",
            "pattern": "^[A-Za-z0-9][A-Za-z0-9_.:-]{0,127}$"
          },
          "oracle_ids": {
            "type": "array",
            "items": {
              "type": "string",
              "pattern": "^[A-Za-z0-9][A-Za-z0-9_.:-]{0,127}$"
            },
            "minItems": 1,
            "uniqueItems": true
          },
          "expected_evidence": {
            "type": "array",
            "items": {
              "type": "string",
              "minLength": 1,
              "pattern": "\\S"
            },
            "minItems": 1,
            "uniqueItems": true
          },
          "necessity": {
            "type": "object",
            "additionalProperties": false,
            "properties": {
              "kind": {
                "enum": [
                  "user_explicit",
                  "necessary_condition"
                ]
              },
              "request_refs": {
                "type": "array",
                "items": {
                  "type": "object",
                  "additionalProperties": false,
                  "properties": {
                    "request_id": {
                      "type": "string",
                      "pattern": "^[A-Za-z0-9][A-Za-z0-9_.:-]{0,127}$"
                    },
                    "quote": {
                      "type": "string",
                      "minLength": 1,
                      "pattern": "\\S"
                    }
                  },
                  "required": [
                    "request_id",
                    "quote"
                  ]
                },
                "minItems": 1,
                "uniqueItems": true
              },
              "explanation": {
                "type": "string",
                "minLength": 1,
                "pattern": "\\S"
              }
            },
            "required": [
              "kind",
              "request_refs",
              "explanation"
            ]
          }
        },
        "required": [
          "id",
          "requirement_ids",
          "flow_id",
          "oracle_ids",
          "expected_evidence",
          "necessity"
        ]
      },
      "minItems": 1,
      "uniqueItems": true
    },
    "exclusions": {
      "type": "array",
      "items": {
        "type": "object",
        "additionalProperties": false,
        "properties": {
          "id": {
            "type": "string",
            "pattern": "^[A-Za-z0-9][A-Za-z0-9_.:-]{0,127}$"
          },
          "description": {
            "type": "string",
            "minLength": 1,
            "pattern": "\\S"
          },
          "requirement_ids": {
            "type": "array",
            "items": {
              "type": "string",
              "pattern": "^[A-Za-z0-9][A-Za-z0-9_.:-]{0,127}$"
            },
            "minItems": 0,
            "uniqueItems": true
          }
        },
        "required": [
          "id",
          "description",
          "requirement_ids"
        ]
      },
      "minItems": 0,
      "uniqueItems": true
    },
    "auxiliary": {
      "type": "array",
      "items": {
        "type": "object",
        "additionalProperties": false,
        "properties": {
          "id": {
            "type": "string",
            "pattern": "^[A-Za-z0-9][A-Za-z0-9_.:-]{0,127}$"
          },
          "purpose": {
            "enum": [
              "requirements_read",
              "data_preparation",
              "evidence_read",
              "analysis",
              "cleanup",
              "diagnosis"
            ]
          },
          "description": {
            "type": "string",
            "minLength": 1,
            "pattern": "\\S"
          },
          "related_scenario_ids": {
            "type": "array",
            "items": {
              "type": "string",
              "pattern": "^[A-Za-z0-9][A-Za-z0-9_.:-]{0,127}$"
            },
            "minItems": 0,
            "uniqueItems": true
          },
          "max_runs": {
            "type": "integer",
            "minimum": 1,
            "maximum": 100
          },
          "stop_condition": {
            "type": "string",
            "minLength": 1,
            "pattern": "\\S"
          }
        },
        "required": [
          "id",
          "purpose",
          "description",
          "related_scenario_ids",
          "max_runs",
          "stop_condition"
        ]
      },
      "minItems": 0,
      "uniqueItems": true
    },
    "assumptions": {
      "type": "array",
      "items": {
        "type": "object",
        "additionalProperties": false,
        "properties": {
          "id": {
            "type": "string",
            "pattern": "^[A-Za-z0-9][A-Za-z0-9_.:-]{0,127}$"
          },
          "statement": {
            "type": "string",
            "minLength": 1,
            "pattern": "\\S"
          },
          "blocking": {
            "type": "boolean"
          }
        },
        "required": [
          "id",
          "statement",
          "blocking"
        ]
      },
      "minItems": 0,
      "uniqueItems": true
    },
    "completion": {
      "type": "object",
      "additionalProperties": false,
      "properties": {
        "execution_complete": {
          "const": "all_required_scenarios_observed"
        },
        "functional_pass": {
          "const": "all_required_oracles_passed"
        },
        "suggestions_block": {
          "const": false
        },
        "preserve_failures": {
          "const": true
        }
      },
      "required": [
        "execution_complete",
        "functional_pass",
        "suggestions_block",
        "preserve_failures"
      ]
    },
    "change": {
      "type": "object",
      "additionalProperties": false,
      "properties": {
        "previous_digest": {
          "anyOf": [
            {
              "type": "string",
              "pattern": "^sha256:[0-9a-f]{64}$"
            },
            {
              "type": "null"
            }
          ]
        },
        "request_refs": {
          "type": "array",
          "items": {
            "type": "object",
            "additionalProperties": false,
            "properties": {
              "request_id": {
                "type": "string",
                "pattern": "^[A-Za-z0-9][A-Za-z0-9_.:-]{0,127}$"
              },
              "quote": {
                "type": "string",
                "minLength": 1,
                "pattern": "\\S"
              }
            },
            "required": [
              "request_id",
              "quote"
            ]
          },
          "minItems": 0,
          "uniqueItems": true
        },
        "impact": {
          "type": "string",
          "minLength": 1,
          "pattern": "\\S"
        }
      },
      "required": [
        "previous_digest",
        "request_refs",
        "impact"
      ]
    },
    "digest": {
      "type": "string",
      "pattern": "^sha256:[0-9a-f]{64}$"
    }
  },
  "required": [
    "apiVersion",
    "kind",
    "id",
    "revision",
    "schema_version",
    "task_id",
    "workspace_id",
    "request_refs",
    "request_digests",
    "source_refs",
    "objectives",
    "subject",
    "flows",
    "requirements",
    "risk_ids",
    "scenarios",
    "exclusions",
    "auxiliary",
    "assumptions",
    "completion",
    "change",
    "digest"
  ],
  "$defs": {
    "scope_ref": {
      "type": "object",
      "additionalProperties": false,
      "properties": {
        "id": {
          "type": "string",
          "pattern": "^[A-Za-z0-9][A-Za-z0-9_.:-]{0,127}$"
        },
        "revision": {
          "type": "integer",
          "minimum": 1
        },
        "digest": {
          "type": "string",
          "pattern": "^sha256:[0-9a-f]{64}$"
        }
      },
      "required": [
        "id",
        "revision",
        "digest"
      ]
    },
    "plan_ref": {
      "type": "object",
      "additionalProperties": false,
      "properties": {
        "id": {
          "type": "string",
          "pattern": "^[A-Za-z0-9][A-Za-z0-9_.:-]{0,127}$"
        },
        "digest": {
          "type": "string",
          "pattern": "^sha256:[0-9a-f]{64}$"
        }
      },
      "required": [
        "id",
        "digest"
      ]
    }
  }
}
