{"apiVersion":"bugate.io/v2","assumptions":[],"auxiliary":[{"description":"Read the declared requirement source","id":"read","max_runs":10,"purpose":"requirements_read","related_scenario_ids":["S1","S2"],"stop_condition":"Source read or bounded failure"},{"description":"Inspect the observed integer failure","id":"diagnose","max_runs":2,"purpose":"diagnosis","related_scenario_ids":["S1","S2"],"stop_condition":"Two probes or a discriminating observation"}],"change":{"impact":"Initial finite scope from the direct user request","previous_digest":null,"request_refs":[]},"completion":{"execution_complete":"all_required_scenarios_observed","functional_pass":"all_required_oracles_passed","preserve_failures":true,"suggestions_block":false},"digest":"sha256:9717b7810ea98fdc5f5bbf7e0f38e6e715ee5c7f981fc9e835e2a8af8c82cd88","exclusions":[{"description":"Security, load, concurrency and unrelated compatibility campaigns","id":"EX1","requirement_ids":[]}],"flows":[{"branch_of":null,"entry":"Integer argument","id":"F1","key_nodes":["Evaluate bounded value","Observe exact result"],"objective_ids":["G1"],"terminal":"Expected integer returned"}],"id":"acceptance","kind":"ScopeContract","objectives":[{"id":"G1","request_refs":[{"quote":"R1: Positive integers retain their value; zero and negative integers produce zero. K1: Negative boundary.","request_id":"dsh-request-6d5259a6598a640f925cff0c8afaddfe"}],"statement":"Verify only the requested bounded integer results"}],"request_digests":{"dsh-request-6d5259a6598a640f925cff0c8afaddfe":"sha256:3ead33d59fdf9a100e16613443e7fea849405b1d488fa57d3488202b2a0ae454"},"request_refs":[{"quote":"R1: Positive integers retain their value; zero and negative integers produce zero. K1: Negative boundary.","request_id":"dsh-request-6d5259a6598a640f925cff0c8afaddfe"}],"requirements":[{"basis":{"explanation":"The direct request explicitly includes positive and negative integer behavior; both branches are needed, with no new risk categories.","kind":"user_explicit","request_refs":[{"quote":"R1: Positive integers retain their value; zero and negative integers produce zero. K1: Negative boundary.","request_id":"dsh-request-6d5259a6598a640f925cff0c8afaddfe"}]},"id":"R1","objective_ids":["G1"],"oracle_ids":["O1"]}],"revision":1,"risk_ids":["K1"],"scenarios":[{"expected_evidence":["Exact result matches O1"],"flow_id":"F1","id":"S1","necessity":{"explanation":"The direct request explicitly includes positive and negative integer behavior; both branches are needed, with no new risk categories.","kind":"user_explicit","request_refs":[{"quote":"R1: Positive integers retain their value; zero and negative integers produce zero. K1: Negative boundary.","request_id":"dsh-request-6d5259a6598a640f925cff0c8afaddfe"}]},"oracle_ids":["O1"],"requirement_ids":["R1"]},{"expected_evidence":["Exact result matches O1"],"flow_id":"F1","id":"S2","necessity":{"explanation":"The direct request explicitly includes positive and negative integer behavior; both branches are needed, with no new risk categories.","kind":"user_explicit","request_refs":[{"quote":"R1: Positive integers retain their value; zero and negative integers produce zero. K1: Negative boundary.","request_id":"dsh-request-6d5259a6598a640f925cff0c8afaddfe"}]},"oracle_ids":["O1"],"requirement_ids":["R1"]}],"schema_version":"2.1.0-dev.1","source_refs":["SRC1"],"subject":{"context_boundaries":["Temporary Python process; no network or company SUT"],"environment_ids":["local-fixture"],"object":"Generated bounded integer function"},"task_id":"same-task","workspace_id":"sha256:cdfdb32e721f3faffef5ba403eebe28f0a19a1fb81d2b00dd530e8962c65c9e2"}
